,Reviews,KeyWords,text
183,want add app phone ,"['want', 'add', 'app', 'phone']",I want to add this app to my phone please
184,easy app sri ,"['easy', 'app', 'sri']",Very easy app for every Sri lankan
185,emergency use ,"['emergency', 'use']",for emergency we can use
186,service see road traffic driver need cancel good ,"['service', 'see', 'road', 'traffic', 'driver', 'need', 'cancel', 'good']",baddest service ever i seen. when road have traffic every driver need to cancel. this is not a good service.
187,app slow driver end trip ,"['app', 'slow', 'driver', 'end', 'trip']",newer app is extreamly slow to produse the amount when the driver end the trip
188,simply say love app map clear identify correctly fix soon hint develop like thank ,"['simply', 'say', 'love', 'app', 'map', 'clear', 'identify', 'correctly', 'fix', 'soon', 'hint', 'develop', 'like', 'thank']","Simply I am saying I love this app but ""the map"" is not clear,therefore can't identify locations and vehicales correctly...plz fix this soon.I give you a hint *Develop the pickme map like UBER.Thank you."
189,feature enable currently hire available time driver arrive significantly outright refuse come finish current tell ,"['feature', 'enable', 'currently', 'current', 'hire', 'available', 'time', 'driver', 'arrive', 'significantly', 'outright', 'refuse', 'come', 'finish', 'tell']",Pickme implemented a feature for drivers which will enable them to take hires even when they are currently on a hire if there are no other vehicles available. This has increased the time for a driver to arrive significantly and most drivers outright refuse to come AFTER finishing their current hire telling various reasons.
190,st taxi app option add stop edit help need ,"['st', 'taxi', 'app', 'option', 'add', 'stop', 'edit', 'help', 'need']",1st taxi app in srilanka if u give us a option to add stop and edit directions will be most help full and we need that option
191,app good easy use location see os wrong add safety ,"['app', 'good', 'easy', 'use', 'location', 'see', 'os', 'wrong', 'add', 'safety']",This app is good and easy to use but the location seen on the google maps os wrong.Also they should add some safety features to the app.
192,long time food delivery costumer starvation ,"['long', 'time', 'food', 'delivery', 'costumer', 'starvation']",takes long time for the food delivery. costumer will have to go starvation first before food is delivered.
193,rate unfortunately hire come km vehicle show near ,"['rate', 'unfortunately', 'hire', 'come', 'km', 'vehicle', 'show', 'near']","I would rate this but unfortunately, gps sucks. The hire comes with in 10km when there are vehicle shown near by"
194,attempt fetch taxi app need improvement fix user friendly ,"['attempt', 'fetch', 'taxi', 'app', 'need', 'improvement', 'fix', 'user', 'friendly']",My first attempt to fetch a taxi through this app was a faliure. Need improvement. Fix the bugs. Make this more user friendly.
195,app slow map driver location accurate ,"['app', 'slow', 'map', 'driver', 'location', 'accurate']",App is slow and still the map and the driver's location is not accurate.
196,hi update app set home location photo easily find ,"['hi', 'update', 'app', 'set', 'home', 'location', 'photo', 'easily', 'find']",But... Hi...Please UPDATE Pickme App To Set Home Location With Home Photo...Than Pickme Drivers Can Easily Find Out Our Home...
197,bad experience food delivery thumb ,"['bad', 'experience', 'food', 'delivery', 'thumb']",worst experience in food delivery 👎👎👎👎👎👎👎👎👎👎👎👎
198,install food ride ,"['install', 'food', 'ride']",canot install to pickme food ride
199,apple try select location add ,"['apple', 'try', 'select', 'location', 'add']",the Apple keeps crashing when I try to select a location which I have added to favourites
200,order food hour rider confirm answer show cook shame dinner tomorrow need compensation wastage time nuisance pick app ,"['order', 'food', 'hour', 'rider', 'confirm', 'answer', 'show', 'cook', 'shame', 'dinner', 'tomorrow', 'need', 'compensation', 'wastage', 'time', 'nuisance', 'pick', 'app']","I ordered food on pickme it's been 1 hour and 30 minutes since the order, no rider confirmed it nor did I get any call. When I called the hotline the answer is a rider has confirmed and will call. Still its showing as your order is cooking. Such a shame, this was my dinner order and they messed it, if they confirm the order tomorrow I am complaining and I will need compensation for the wastage of time and nuisance pick me has caused me. Such a shame, app is so full of bugs... Shame."
201,need separate app food long load select tab grimace face ,"['need', 'separate', 'app', 'food', 'long', 'load', 'select', 'tab', 'grimace', 'face']",Need a separate app for FOOD. using the same app sucks since it takes too long to load and crashes often when we select the food tab 😬
202,food way contact driver ,"['food', 'way', 'contact', 'driver']",PickMe food no way to contact driver
203,careless people unprofessional work cheep price experience not recommend ,"['careless', 'people', 'unprofessional', 'work', 'cheep', 'price', 'experience', 'not', 'recommend']",Careless people and unprofessional drivers are work with them you can go for cheep price with cheep experience. Not recommend at all.
204,app good need like reason match wrong time map root reach exact location late issue loading say available region ,"['app', 'good', 'need', 'like', 'reason', 'match', 'wrong', 'time', 'map', 'root', 'reach', 'exact', 'location', 'late', 'issue', 'loading', 'say', 'available', 'region']",app is good but need some options like customers comments when complaining about drivers because some reason are not matching with your options. and wrong roots when pickups. ( in some times your map's root cannot reach the exact location ) and latest issue is app is not loading some times saying not available in my region.
205,late update app crash proceed rate trip ,"['late', 'update', 'app', 'crash', 'proceed', 'rate', 'trip']",latest update causes the app to crash. cannot proceed beyond rating of last trip.
206,not install use public bus sit save money time good luck ,"['not', 'install', 'use', 'public', 'bus', 'sit', 'save', 'money', 'time', 'good', 'luck']",Dont install. Use a public bus. Sit and go with abus. Save your money and time. Good luck.
207,don use service cheat people try root intention earn money like advice introduce fix price instead approximate valuable definitely black mark company reputation thank ,"['don', 'cheat', 'people', 'try', 'root', 'intention', 'earn', 'money', 'advice', 'introduce', 'fix', 'instead', 'approximate', 'valuable', 'definitely', 'black', 'mark', 'company', 'reputation', 'thank']","Don't use this service. Their drivers are cheating people. They try to go trips from the longest root with the intention of earning more cheat money. I would like to give one advice to pickMe, please introduce fixed price instead of approximate price. Because your drivers are cheating your valuable customers. That definitely a black mark for the company reputation. Thank You"
208,app good need improve poor driver image map high route twice close reopen great use rely ,"['app', 'good', 'need', 'improve', 'poor', 'driver', 'image', 'map', 'high', 'route', 'twice', 'close', 'reopen', 'great', 'use', 'rely']","app is good but it needs to improve. gps positiong is very poor. driver arrives earlier than the image on map.prices go very high if you put a same route twice,or close and reopen the app. still uber is great even they had fewer vehicles.you should use but don't rely on this app."
209,food not track driver show ,"['food', 'not', 'track', 'driver', 'show']",Pickme Food Cant Track Where Is The Driver At Its Not Showing Me
210,need update ,"['need', 'update']",but need to update
211,good job add book later thumbs thumb ,"['good', 'job', 'add', 'book', 'later', 'thumbs', 'thumb']",good job.pls add tuk also to the book later.👍👍👍👍👍👍👍👍👍👍👍👍👍👍👍👍👍
212,app worth update driver movement navigation wonderful try understand idiot ,"['app', 'worth', 'update', 'driver', 'movement', 'navigation', 'wonderful', 'try', 'understand', 'idiot']",This app is not worth Can you please update the driver movement on navigation to pickme app... Ubereats app is wonderful... Try to understand idiot
213,feel service good poor driving experience like company ,"['feel', 'service', 'good', 'poor', 'driving', 'experience', 'like', 'company']","I FEEL there service is good, but poor Driving experience of most Drivers.. but I like this company..."
214,pick fund terrorism sri not use ,"['pick', 'fund', 'terrorism', 'sri', 'not', 'use']",pick me funds islamic terrorism in sri lanka dont use
215,word advice use well quality service availability ,"['word', 'advice', 'use', 'well', 'quality', 'service', 'availability']",One word of advice use uber better and quality service and much more availability of drivers
216,find trip app submit complaint messenger finally extra ,"['find', 'trip', 'app', 'submit', 'complaint', 'messenger', 'finally', 'extra']","I didn't find my trip in the app so I couldn't submit a complaint. I had to submit a complaint after many trials by email and messenger. Finally I was refunded the extra amount I have paid, but still I see that I am overcharged!!"
217,colleague book app go route destination pick location map collect fare cheat uninstalle ,"['colleague', 'book', 'app', 'go', 'route', 'destination', 'pick', 'location', 'map', 'collect', 'fare', 'cheat', 'uninstalle']",me and my colleague booked another app and went through shortest route to the destination. pick me using very longest route in their location map to collect more fare amount. this is cheating no. we uninstalled the pickme app.
218,uninstalle app order food want taxi ton data odd reason abnormal like th understand datum static map bit place restaurant assign rider maybe population shrunk ,"['uninstalle', 'order', 'want', 'ton', 'data', 'odd', 'reason', 'abnormal', 'th', 'understand', 'datum', 'static', 'bit', 'place', 'restaurant', 'assign', 'rider', 'maybe', 'population', 'shrunk']","I uninstalled this app for 2 reasons: 1. When you order food or want a taxi, the app uses a ton of data for some odd reason, which is quite abnormal. I ve used uber as well which consumes like 1/5th of pickme. Most of my friends have also complained on this. I don't understand why so much data is required for a static map and bit of GPS. 2. On pickme food, when you place an order and the restaurant accepts the order it takes ages to assign a rider (maybe the rider population has shrunk)."
219,not use ,"['not', 'use']",Please dont use pickme anymore.
220,talk late update show location ,"['talk', 'late', 'update', 'show', 'location']","Talking about PickMe foods, the latest update does not showing the biker's location."
221,zee add water ,"['zee', 'add', 'water']","r see we a zee£3#¥eisiiq Zuhu,def*I add Wessex Water my, a l 3 ,wW ZZ Dr df"
222,useful value money quick hassle driver comfortable thank ,"['useful', 'value', 'money', 'quick', 'hassle', 'driver', 'comfortable', 'thank']","very useful no trable value for money, very quick no hassle. no arrgive with driver so comfortable thank you"
223,don use service ,"['don', 'use', 'service']",Don't use muslim service use srigo
224,bad experience food service poor long delivery time not review person urgent cancel thumb ,"['bad', 'experience', 'food', 'service', 'poor', 'long', 'delivery', 'time', 'not', 'review', 'person', 'urgent', 'cancel', 'thumb']","worst experience. pickme food service is very very poor , they take long periuod of delivery time, cant review the delivery person & resturents, if any urgent we cant cancel the oders.👎👎👎"
225,comfortable speed level slow pick sri ,"['comfortable', 'speed', 'level', 'slow', 'pick', 'sri']",not comfortable speed level slow pick me is on sri lanka only it's not in out of Colombo
226,wait calculate stuck yo taxi journey distance ,"['wait', 'calculate', 'stuck', 'yo', 'taxi', 'journey', 'distance']","waiting calculated when we stuck on trafic,but yo go taxi only charged for our journey distance."
227,pick food slow order hour ,"['pick', 'food', 'slow', 'order', 'hour']",your pick me food is very slow I was ordered before one hour that's not delivered to me
228,present reasonable ,"['present', 'reasonable']",Present rates are reasonable.
229,area ,['area'],not delivering to minuwangoda area
230,app pretty good food delivery time find driver not cancel ready ,"['app', 'pretty', 'good', 'food', 'delivery', 'time', 'find', 'driver', 'not', 'cancel', 'ready']","the rides in this app is pretty good but food delivery is more frustrating...spends more time to find a driver..n cant even cancel the food delivery,even though the driver isn't ready..so frustrated"
231,pick food ,"['pick', 'food']",In negombo there is not pick me food
232,loyal like yer mnt help chang hope ur team lose good ,"['loyal', 'like', 'yer', 'mnt', 'help', 'chang', 'hope', 'ur', 'team', 'lose', 'good']",i hv been a loyal custmr 4 like 3yers nw. u give others discout and i hvnt recived any sms since 3mnts. please any 1 help me out. other than tis i will chang 2 uber. hope ur supprt team can undrsnd this. if not u just lost a good custmr
233,hi absolutely pick experience forget rate feedback soon drive try later find method provide solution trip thank great improve ,"['hi', 'absolutely', 'pick', 'experience', 'forget', 'rate', 'feedback', 'soon', 'drive', 'try', 'later', 'find', 'method', 'provide', 'solution', 'trip', 'thank', 'great', 'improve']","Hi! Absolutely enjoyed my pick me experience. However, I forget to rate or give feedback on drivers soon after the drive. When I try to give feedback later I don't find a method to do so. Please provide a solution. That is, a method to give feedback on drivers sometime after the trip. Thanks. PickMe is great. Keep improving. :)"
234,bad app update order food response cancel hour ,"['bad', 'app', 'update', 'order', 'food', 'response', 'cancel', 'hour']",worst app after the update. I ordered food but I didn't get any response from riders and I couldn't cancel my order also.I waited for 1 hour
235,unprofessional racism ,"['unprofessional', 'racism']",unprofessional drivers mostly because of racism and facism.
236,save money ,"['save', 'money']",uninstall to save my money
237,food delivery work ,"['food', 'delivery', 'work']",pickme food delivery services is not working for Malabe
238,good like update customer meter time use mode transportation pay large wait charge start get vehicle journey appreciate bring soon ,"['good', 'like', 'update', 'customer', 'meter', 'time', 'use', 'mode', 'transportation', 'pay', 'large', 'wait', 'charge', 'start', 'get', 'vehicle', 'journey', 'appreciate', 'bring', 'soon']",pickme is really good but I would like an update where you get an otp from the customer and then the meter starts because every time I use this mode of transportation I have to pay a large amount and the drivers say it is the waiting charge. how can they start their even before we've got into the vehicle and started our journey? I would really appreciate if you could bring in this update soon
239,funny charge people show price beginning trip don deceive bad app ,"['funny', 'charge', 'people', 'show', 'price', 'beginning', 'trip', 'don', 'deceive', 'bad', 'app']",It is so funny how you charge from people showing less estimated price at the beginning of the trip scheduling and keep adding amount when on the trip. Don't deceive people. Such a worst app when compared to uber.
240,worst app time need add fair fine price location pay driver ,"['worst', 'app', 'time', 'need', 'add', 'fair', 'fine', 'price', 'location', 'pay', 'driver']",worst app ever. if you have promotions every time need to add promo cords. fair is not fine. app shows a price to go to location. and after go there the app shows more than price to pay driver.
241,responsive user friendly ,"['responsive', 'user', 'friendly']",very responsive and user friendly
242,fantastic marvelous transportation app sri ,"['fantastic', 'marvelous', 'transportation', 'app', 'sri']","This is the fantastic,marvelous transportation app in Sri Lanka.."
243,make life easy touch vehicle door step ,"['make', 'life', 'easy', 'touch', 'vehicle', 'door', 'step']","making the life easy, touch of a botton vehicle at your door step within few minutes."
244,not need use kind telling meter count begin actually start answer poor maintenance remove useless ,"['not', 'need', 'use', 'kind', 'telling', 'meter', 'count', 'begin', 'actually', 'start', 'answer', 'poor', 'maintenance', 'remove', 'useless']","we dont need to use this kind of applications . you telling customers meter count begun on 60 Rs but actually counting starting on 70 Rs , anyone can give a resonable answer for it. very poor maintenance . srilanka shud remove this kind of useless apps"
245,poor service like garbage not use ,"['poor', 'service', 'like', 'garbage', 'not', 'use']","Very Poor Service , Like a Garbage . Dont use this..."
246,reserved money unwanted like ,"['reserved', 'money', 'unwanted', 'like']",they reserved money for unwanted things like pog.
247,come short waste time ,"['come', 'short', 'waste', 'time']",They won't be coming for short rides. Just a waste of time.
248,poor service price calculation ,"['poor', 'service', 'price', 'calculation']","poor service, erros in price calculation"
249,don use app treat ,"['don', 'use', 'app', 'treat']",Don't use this app. They don't treat customers well.
250,prefer come short distance confused face ,"['prefer', 'come', 'short', 'distance', 'confused', 'face']",drivers not prefer to come for short distances...They come up with various reasons to not to come for the short distance hires😕
251,high price suitable fro sri ,"['high', 'price', 'suitable', 'fro', 'sri']","high price, not suitable fro sri lankans,"
252,poor service company ,"['poor', 'service', 'company']",drivers are too badand very poor service from the company
253,price high unfair ,"['price', 'high', 'unfair']",price is very high and unfair
254,satisfied new improve location service ,"['satisfied', 'new', 'improve', 'location', 'service']",Satisfied with new features. Should improve the location service more
255,service disgusting ,"['service', 'disgusting']",service is really disgusting
256,stop bye app complex food truck think better example area unwanted process ,"['stop', 'bye', 'app', 'complex', 'food', 'truck', 'think', 'better', 'example', 'area', 'unwanted', 'process']","Stopped using this. bye. . . now the app is really complex, food, trucks are all in one app. sometimes it stucks. i think the app would be modularized, keep separated would be better. example : im not using pickme food (my area does not have pickme food) but app shows some unwanted process."
257,help university sure time leave service eventually ,"['help', 'university', 'sure', 'time', 'leave', 'service', 'eventually']",don't download this ! this is Muslim and they help to Sharia university. make sure that this is the time to leave this service and eventually move to Taxime service.
258,not use service ,"['not', 'use', 'service']",dont use. this service. terrorists
259,unfair untrusted hide cost waiting not use ,"['unfair', 'untrusted', 'hide', 'cost', 'waiting', 'not', 'use']",very unfair aplication.peopls untrusted.hide cost for waiting .dont use anyone
260,service better pick ,"['service', 'better', 'pick']",This service is sucks..uber is better than pick me.
261,high ,['high'],High prices . Download Tripmo
262,charge high cost ,"['charge', 'high', 'cost']",always charge higher than estimated cost.
263,not use ,"['not', 'use']",I dont use any more....
264,poor service company treat prefer ,"['poor', 'service', 'company', 'treat', 'prefer']",very poor service. and this company doesn't even treat their drivers well. I Prefer YOGO
265,bad taxi see charge extra bring stall pick tell driver date time inform people like hand ,"['bad', 'taxi', 'see', 'charge', 'extra', 'bring', 'stall', 'pick', 'tell', 'driver', 'date', 'time', 'inform', 'people', 'like', 'hand']",one of the worst taxi services i have ever seen.. drivers charge rs.50 extra for the things we bring from any stall... and they say that you(pick me) have only told them to take so.... driver name kumar... Date 3/5/2019... time 12:30.... please inform the people if you are doing anything like this before hand.
266,company sri ,"['company', 'sri']",isis company of Sri Lanka
267,use well ,"['use', 'well']",use uber its better than pickme
268,price show handbill flat range ,"['price', 'show', 'handbill', 'flat', 'range']",The price shown on the handbill is flat or its range?
269,driver access cancel trip customer waiting ,"['driver', 'access', 'cancel', 'trip', 'customer', 'waiting']","Driver access to cancel the trip when customer is waiting, must be controlled."
270,use waste time money charge ,"['use', 'waste', 'time', 'money', 'charge']",please don't use this it is waste of time and money always charge more
271,app high unprofessional unethical long route destination increase price rider ,"['app', 'high', 'unprofessional', 'unethical', 'long', 'route', 'destination', 'increase', 'price', 'rider']",The app is ok. Charges are high. Drivers are unprofessional and unethical. Pickme drivers will take a longer route to the destination so they they can increase the price charged to the rider.
272,code ,['code'],what the *************** promo code
273,maintain pick food delivery ,"['maintain', 'pick', 'food', 'delivery']",please maintain a pick me food delivery in Habarana
274,application frequently complicate app show wrong time ,"['application', 'app', 'frequently', 'complicate', 'show', 'wrong', 'time']",The application is updated too frequently and is complicated .Due to this I did not have the app for 3 months .Also the locations shown are wrong most of the time
275,pick take money book car vehicle ,"['pick', 'take', 'money', 'book', 'car', 'vehicle']",pick me is taking too much money when we book a car or any vehicle
276,ma trip eke charge mage ora ,"['ma', 'trip', 'eke', 'charge', 'mage', 'ora']",Ma Ena Gaana Oru Inne Trip Eke Charge Eka 260.00 Mage Gfva Bussala Eyata Salli Dhunnama Ora Thakkadiya 100k Wediyen Illagana
277,optional force brand new ample memory elderly simple upgrade difficult use app appreciate lite version people choose ,"['optional', 'force', 'brand', 'new', 'ample', 'memory', 'elderly', 'simple', 'upgrade', 'difficult', 'use', 'app', 'appreciate', 'lite', 'version', 'people', 'choose']",updates should be optional.... you are forcing to do it.... not all users have brand new phones with ample memory. and elderly users are used to simple settings ... upgrade make it difficult to use the app... would appreciate if you could have a Lite App and another version with all gimmicks so people could choose.
278,inconvenient pick ,"['inconvenient', 'pick']",this is so inconvenient. what happened to pick me?
279,high prize user ,"['high', 'prize', 'user']",high prize so I changed user. .it has lowest prizes and fastest
280,come car ,"['come', 'car']",go and come car full
281,add real map time work tired face ,"['add', 'real', 'map', 'time', 'work', 'tired', 'face']",Please add the real map.. some times not working to this...😫😫😫😫😫
282,good app people sri come transportation ,"['good', 'app', 'people', 'sri', 'come', 'transportation']",it is a good app which helps the people in sri lanka when coming to the transportation side
283,not feedback form trip ,"['not', 'feedback', 'form', 'trip']",i didnt recieve feedback form of last trip
284,great app add high way ,"['great', 'app', 'add', 'high', 'way']",great app. please add high way charges in the app
285,show location correctly ,"['show', 'location', 'correctly']",not showing the location correctly
286,food deliver say order big disappointing response ,"['food', 'deliver', 'say', 'order', 'big', 'disappointing', 'response']",PickMe Food Sucks! The drivers refused to deliver saying that the order is big. Disappointing response from the drivers.
287,find food super easy thank make eat enjoyable white medium star ,"['find', 'food', 'super', 'easy', 'thank', 'make', 'eat', 'enjoyable', 'white', 'medium', 'star']",once finding food has been a supre hazzle and you made it super easy. thank you for making eating enjoyable ⭐
288,use ,['use'],It is very convienience to use
289,location pick ,"['location', 'pick']",im at rajagiriya .location picked somewhere medirigiriya
290,happy service provide improve thank ,"['happy', 'service', 'provide', 'improve', 'thank']",very happy with the service provide. drivers should improve their attitudes more. Thanks pickme
291,excellent suggestion add new like multiple location select custom route wait time fix zoom bug map ,"['excellent', 'suggestion', 'add', 'new', 'like', 'multiple', 'location', 'select', 'custom', 'route', 'wait', 'time', 'fix', 'zoom', 'bug', 'map']","Excellent.my suggestion is add new features like : multiple location select, custom route select, if add multiple location adding also custom waiting time select....fix zoom bug on map"
292,force app like night book open update late version barely data stupid policy wait long time bus arrive ,"['force', 'app', 'like', 'night', 'book', 'open', 'update', 'late', 'version', 'barely', 'data', 'stupid', 'policy', 'wait', 'long', 'time', 'bus', 'arrive']","You have to be kidding me, forcing updates on an app like this. Last night i needed to book a tuk but when i open the it says update to latest version. I barely had data to book a tuk but bcz of your stupid update policy i had to wait a long time until a bus arrive"
