,Reviews,KeyWords,text
629,price little expensive normal taxi ,"['price', 'little', 'expensive', 'normal', 'taxi']",price is little expensive than normal taxi
630,hud app wat know guess ,"['hud', 'app', 'wat', 'know', 'guess']",It jus a hud app and that's Wat I know  I guess hmm d
631,user friendly ,"['user', 'friendly']",User friendly  !
632,service good point wait uncalled daily endure heavy traffic get stick reason client bare extra understandable run look ,"['service', 'good', 'point', 'wait', 'uncalled', 'daily', 'endure', 'heavy', 'traffic', 'get', 'stick', 'reason', 'client', 'bare', 'extra', 'understandable', 'run', 'look']","While the service is good, must point out that the 'Waiting Charges' you put upon the clients are uncalled for. Daily commuters in colombo areas has to endure heavy traffic and getting stuck in one shouldn't be a reason for the client to bare extra costs. Its understandable if the client stops somewhere to run errands. Please look into this."
633,use app time charge ,"['use', 'app', 'time', 'charge']",Drivers who use this app always talks and annoys at the same time they charge more than Uber.
634,service disgust no peak time night pm hell point app use add staff job ,"['service', 'disgust', 'no', 'peak', 'time', 'night', 'pm', 'hell', 'point', 'app', 'use', 'add', 'staff', 'job']",Your service is just disgusting. No one picks the rides in peak times or at night even after 7pm. What the hell. Uninstalling this. No point of having an app without any use. Please add staff who can be committed to their job.
635,try time constantly pick sure track ,"['try', 'time', 'constantly', 'pick', 'sure', 'track']",I tried last few times. Drivers constantly declining the trips and make me really annoyed. Pick me sure to have some track of cancellations
636,efficient way review app bad fast pay cash need enter card recommend great sri ,"['efficient', 'way', 'review', 'app', 'bad', 'fast', 'pay', 'cash', 'need', 'enter', 'card', 'recommend', 'great', 'sri']",It is the most efficient and fastest way of travelling in Colombo and do not review this app as bad.It is really fast and you can pay cash .There is no need of entering card numbers and I recommend this app as a great acheivment in Sri Lanka.
637,way edit rating mistakenly rate ,"['way', 'edit', 'rating', 'mistakenly', 'rate']",There's no way to edit a rating once we mistakenly rated someone.
638,location box turn ,"['location', 'box', 'turn']",The location dialog box will not go off even after I turn the location on
639,easy way book cab urban use good number ,"['easy', 'way', 'book', 'cab', 'urban', 'use', 'good', 'number']","One of the easiest way to book a tuk or a cab in urban areas, easy  to use UI and they have a good number of vehicles too"
640,regard app peak time ,"['regard', 'app', 'peak', 'time']","Nothing with regard to the app, however there are no Tuks during the peak times"
641,slow mobile ,"['slow', 'mobile']",it's really slow for my mobile
642,better late update critical bug major app calculate arrival time disappointed ,"['better', 'late', 'update', 'critical', 'bug', 'major', 'app', 'calculate', 'arrival', 'time', 'disappointed']",This was better before the last 2 updates. And now the latest update says critical bug fixes. But it seems you guys introduced major bugs to the app. It takea ages to calculate even the arrival time. So disappointed!
643,late update app find cab near ,"['late', 'update', 'app', 'find', 'cab', 'near']","After the latest update, this app takes for ever to find a cab near me!"
644,thank ,['thank'],Thank you.. very much..
645,good app service vacation use pick lose pad taxi customer help initially driver answer care come get item thank job ,"['good', 'app', 'service', 'vacation', 'use', 'pick', 'lose', 'pad', 'taxi', 'customer', 'help', 'initially', 'driver', 'answer', 'care', 'come', 'get', 'item', 'thank', 'job']",Its good app and service. During my vacation I use pick me and it gives good service ones I lost my I pad in the taxi and I call the pick me customer service to help an initially driver didn't answer the call after pick me customer care comes in I got the lost item ...Thanks  they did the job.
646,take open app absolutely test patience need ,"['take', 'open', 'app', 'absolutely', 'test', 'patience', 'need']",Taking years to open up the app. Absolutely testing my patience in need.
647,app user friendly lot slow ,"['app', 'user', 'friendly', 'lot', 'slow']","The app UI is not user friendly, lags a lot and very slow!"
648,rude specially refuse come trip short speaking ,"['rude', 'specially', 'refuse', 'come', 'trip', 'short', 'speaking']",The drivers are very rude specially the trishaw one's  They refuse to come if the trip is short and are very rude when speaking to them to give directions
649,price know talk possible try add new feature book vehicle person different location phone number confirmation driver communicate specific ,"['price', 'know', 'talk', 'possible', 'try', 'add', 'new', 'feature', 'book', 'vehicle', 'person', 'different', 'location', 'phone', 'number', 'confirmation', 'driver', 'communicate', 'specific']",The price ranges are ok with PickMe but some of the drivers in the tuks doesn't even know how to talk to the customers. If its possible please try to add a new feature where I can book a vehicle for another person who is staying in a different location by adding that person's phone number before the booking confirmation so that the driver can communicate with that specific person.
650,trip order ride ,"['trip', 'order', 'ride']",After this one trip i couldn't order a ride
651,know use go need map update double confirm driver boarding pick like far km away plain come understand communicate super difficult specially want destination service provide terrible don bad ,"['know', 'go', 'map', 'double', 'confirm', 'boarding', 'far', 'km', 'away', 'plain', 'understand', 'communicate', 'super', 'difficult', 'specially', 'want', 'destination', 'provide', 'terrible', 'don']","Drivers don't know how to use Google Maps, always asking us where are we going and where we are, we even need to show them how to use the Map. Drivers changed their cars and did not update, needing us to double confirm the driver's details before boarding. Drivers refused our calls to pick us due to reasons like ""The driver are too far (when they are just less than 2km away from us) or they don't know where are we going and just plain refused to come"" Drivers can't really understand English much, communicating is super difficult, specially when you want them to go to your destination. All in all, the service provided by the drivers is very terrible. Don't even know how Pickme selects its drivers. VERY VERY BAD."
652,use en quick service ,"['use', 'en', 'quick', 'service']",Very use full en quick service
653,good business concept book car trip confirmation receive app search till completion way know ,"['good', 'business', 'concept', 'book', 'car', 'trip', 'confirmation', 'receive', 'app', 'search', 'till', 'completion', 'way', 'know']","Good business concept, but when I book a car, even if the trip confirmation sms received, app still searching for the vehicles. Till the trip completion sms received, no way to know whether the trip is completed or still on"
654,highly appreciate convenient safe way travel polite thank lot ,"['highly', 'appreciate', 'convenient', 'safe', 'way', 'travel', 'polite', 'thank', 'lot']",Highly appreciate your services. Very convenient & safe way of traveling. Drivers are so polite. Thanks a lot.
655,hopeless need peak morning evening time available ,"['hopeless', 'need', 'peak', 'morning', 'evening', 'time', 'available']",Hopeless when you need it. At peak (morning & evening) times...no vehicles are available.
656,cheap easy use ,"['cheap', 'easy', 'use']",very cheap and easy to use
657,cancel trip short ,"['cancel', 'trip', 'short']",Most of the drivers cancel the trip if our trip too short.
658,pick wow want ,"['pick', 'wow', 'want']",Pick me is wow But we want benefits.
659,good like ,"['good', 'like']",Pickme  is a best  i like  pickme
660,time wheeler second cab lounge road driver fort far come fault cancel book app say pick extremely job inform show close ,"['time', 'wheeler', 'second', 'cab', 'lounge', 'road', 'driver', 'fort', 'far', 'come', 'fault', 'cancel', 'book', 'say', 'pick', 'extremely', 'job', 'inform', 'show', 'close']","The first time I called a PickMe 3 wheeler I had no problems. The second time I called a PickMe cab from Java lounge, Jawatte road. The driver phones me back and tells me he was in Fort and it's too far for him to come to where I was! He sounded as if it was my fault that he was called!!! I asked him what he wanted me to do. He tells me to cancel my booking and re-book thru the app. I did as he said. The second driver also phones me and tells me he was too far and couldn't come to pick me up!!! My fault again! I was extremely annoyed! Is it my job to inform the closest driver to come get me? The app was showing several vehicles close by!"
661,no time ,"['no', 'time']",No vehicles every time
662,better reduce recent price change unfair cause improvement service pay extra trip sense budget taxi start prize worth overall good attempt great concept ,"['better', 'reduce', 'recent', 'price', 'change', 'unfair', 'cause', 'improvement', 'pay', 'extra', 'trip', 'sense', 'budget', 'start', 'prize', 'worth', 'overall', 'attempt', 'great', 'concept']",It would be better if you can reduce the charges. The recent price change is unfair cause there's no improvement in the service. Do we have to pay extra Rs.100 for a trip? It doesn't make any sense at all. I'd rather go by a budget taxi which I have to pay starting prize Rs 50 though. It's worth the prize. Overall this is a good attempt and great concept.
663,need road catch single taxi wheeler ,"['need', 'road', 'catch', 'single', 'taxi', 'wheeler']","You guys need to get more drivers out on the road. It's 4.45 on Friday, and I can't catch a single taxi (Three wheeler or mini). There's nobody to take me."
664,late process like ,"['late', 'process', 'like']",Very late process not like uber
665,start price ,"['start', 'price']",Starting Price is TOO MUCH
666,book booking hire road time waster ,"['book', 'booking', 'hire', 'road', 'time', 'waster']",Drivers accepts the booking and cancels the booking when he get a hire from the road... time waster
667,trip say want km pick ,"['trip', 'say', 'want', 'km', 'pick']",some drivers cancelled the trip dt saying they want to cm 2km to pick us
668,hi drop location red pin say wrong ,"['hi', 'drop', 'location', 'red', 'pin', 'say', 'wrong']",Hi..i put my drop down location which is a red pin but the drivers said they can't see my drop down location. Am I doing something wrong.
669,yesterday order van pick friend tell stop near get hire finish pay rs rude thumb ,"['yesterday', 'order', 'van', 'pick', 'friend', 'tell', 'stop', 'near', 'get', 'hire', 'finish', 'pay', 'rs', 'rude', 'thumb']",Yesterday me and my friends ordered a mini van to go to ethul kotte and then we wanted to pick another friend of us from nagavihara so when we told him to stop near nagavihara he just got pissed and told that the hire is finish and he told he can't go hires with us we payed 144rs we won't order from pick me again u guys are so rude to customers 👎👎👎
670,mention essential taxi app no option day return ride great influence rate instead ask cancel go ,"['mention', 'essential', 'taxi', 'app', 'no', 'option', 'day', 'return', 'ride', 'great', 'influence', 'rate', 'instead', 'ask', 'cancel', 'go']","Lacks to mention all rates, most essential part in taxi app. No option to day it is a return (""back"") ride, great influence on rate. Instead they call to ask, cancel, etc. Why have a app if you are going  to call anyway?"
671,love app frequent user recently add credit card payment time response remove bad customer service totally disappoint ,"['love', 'app', 'frequent', 'user', 'recently', 'add', 'credit', 'card', 'payment', 'time', 'response', 'remove', 'bad', 'customer', 'service', 'totally', 'disappoint']",Used to love this app was a very frequent user but recently Added my credit card for payment. Was charged more. Complained several times no response. Removed the app. Bad customer service. Totally disappointed
672,earth need access telephone privacy violation ,"['earth', 'need', 'access', 'telephone', 'privacy', 'violation']",Why on earth does this need access to my contacts and telephone permissions? This is a privacy violation.
673,dam booking taxi ,"['dam', 'booking', 'taxi']",This is the first dam cheapest online booking taxis.
674,not log know ,"['not', 'log', 'know']",cant log in again dont know why
675,use pick good service completely rude wheeler cancel trip notice location indication inaccurate present show incorrect booking confirm later find vehicle away ,"['pick', 'good', 'completely', 'rude', 'wheeler', 'cancel', 'trip', 'notice', 'location', 'indication', 'inaccurate', 'present', 'show', 'incorrect', 'booking', 'confirm', 'later', 'find', 'vehicle', 'away']",I use Pick me often..  This was a very Good Service.. Now it has changed completely. The drivers are very rude in some three wheeler's.    Some cancel the trip w/out notice.   The location indication is inaccurate.. my present location shown are incorrect.  Booking get confirmed - later to find out that the vehicle is around 5 km away.. so have to cancel the booking.
676,poor service time need taxi ,"['poor', 'service', 'time', 'need', 'taxi']","Poor service.all the time when i need a taxi,they showed no vehicles."
677,cancel trip time pick give proper answer service provider assure driver end destination hire standard coming way care customer reply matter say look ,"['cancel', 'trip', 'give', 'proper', 'answer', 'provider', 'assure', 'driver', 'end', 'destination', 'hire', 'standard', 'coming', 'way', 'care', 'customer', 'reply', 'matter', 'say', 'look']",The drivers cancel the trip without even informing... this has happened to me several times... pick me has not given me a proper answer yet... why...? If pick me is a service provider why can't they assure a proper service also why is the driver asking for the end destination after accepting the hire...? What is the standard coming to...? Is it because pick me has way too many hires to care about customer...? Please give me a reply on this matter not just email saying u will look in to this matter...
678,delay expensive ,"['delay', 'expensive']",Delay in drivers. Too expensive for every rides.
679,app technical evidence driver know bad discipline talk complain customer service team follow time complaint take speak supervisor say till today year lie upgrade run normal charge well comfort pay rate pick taxi origin destination experience extremely fast video ,"['technical', 'evidence', 'discipline', 'talk', 'team', 'follow', 'complaint', 'speak', 'supervisor', 'till', 'year', 'lie', 'upgrade', 'run', 'normal', 'comfort', 'origin', 'extremely', 'fast', 'video']","App is full of technical problems. Can give evidence for it. Most of the driver don't know the roads and locations in colombo, and worst is some drivers don't have discipline, doesn't know how to talk and complain us for their faults. Customer service team does take  complaints. I had to follow up 3 times and realised that the complaint was not taken down. So spoke to the supervisor. He said he will call back after checking but didn't get back till today and it's been more a year. Drivers lie saying that there is a upgrade of the app and run on the normal metre, charging the same. Uber is the better. You get AC, comfort and pay the rate of pick me taxis for the same origin and destination. My last experience with pick me was an extremely fast driver (i have the video of it)."
680,know possible cancellation distance travel reach location feel problem manage trip map give ,"['know', 'possible', 'cancellation', 'distance', 'travel', 'reach', 'location', 'feel', 'problem', 'manage', 'trip', 'map', 'give']","Most of the drivers don't know the Colombo roads. How is it possible?  Some asking for cancellation due to the distance they have to travel to reach the customers' location. Well, I feel that even though the Uber drivers have the same problem of not knowing the Colombo roads, still they manage to make the trip done via their map applications with the given routes in it."
681,experience good today driver tell customer happy guess cause say end go long want home ,"['experience', 'go', 'good', 'today', 'driver', 'tell', 'customer', 'happy', 'guess', 'cause', 'say', 'end', 'long', 'want', 'home']",The experience is really good.  But today a driver told me that they can't see where the customer wants to go.  If they could see it they'd be more happy I guess . Cause he said sometimes they end up going on long runs even when they want just to get back home.
682,app lot set drop location stick difficult use time process recommend ,"['app', 'lot', 'set', 'drop', 'location', 'stick', 'difficult', 'use', 'time', 'process', 'recommend']",This app is with lots of bugs. Can not set the drop off location and sometimes the app get stuck. Really difficult to use. And takes lots of time to process. I do not recommend this app to anyone.
683,bad allow enter drop location ,"['bad', 'allow', 'enter', 'drop', 'location']",Full of bugs. The worst it would not allow to enter drop off location.
684,cool like silver time thing problem shall need use able talk ,"['cool', 'like', 'silver', 'time', 'thing', 'problem', 'shall', 'need', 'use', 'able', 'talk']",Cool promotions. I really like this silver time thing. Only problem is you'll need to get permision to use the promo. Will you able to to talk to my wufe please?
685,good service like ,"['good', 'service', 'like']",Good service.. I like
686,actually easy way taxi location ,"['actually', 'easy', 'way', 'taxi', 'location']","Actually, very easy way to take a taxi Where you location."
687,not bad need improve app slow ,"['not', 'bad', 'need', 'improve', 'app', 'slow']",Not bad but need to improve. And app is too slow compared to others.
688,app slow stick able update phone number complicate register address log account old change reinstall create new exasperate shame cumbersome time use smoother pity service equal ,"['slow', 'stick', 'able', 'phone', 'number', 'complicate', 'register', 'address', 'log', 'account', 'old', 'change', 'reinstall', 'create', 'exasperate', 'shame', 'cumbersome', 'smoother', 'pity', 'equal']","The app is often slow & gets stuck. Also you should be able to update your phone number in the app. Uber allows this. PickMe does not. To complicate things further you cannot register 2 accounts with the same email address. I had to log into my account on my old phone number & change the email address. Then, uninstall the app. Reinstall it & create a new account with my new phone number. Very exasperating! It's a shame the app is so cumbersome....8 out of 10 times I would use Uber just because the app is smoother! It's a pity...because the service levels are equal."
689,big joke wait driver second calculation flexible fare free start meter ,"['big', 'joke', 'wait', 'driver', 'second', 'calculation', 'flexible', 'fare', 'free', 'start', 'meter']",Whats this big joke you do with waiting.if the driver brakes for a second.it starts the waiting calculation.in calculation of waiting in tuks or what ever.you shoul be much flexible to give even 30 seconds fare free.then after start the waiting meter on.
690,wait charge huge like equal normal road taxi ,"['wait', 'charge', 'huge', 'like', 'equal', 'normal', 'road', 'taxi']",your waiting charge is so huge. no one charge like that. with this waiting charges now you are equal normal road taxis.
691,able taxi book different colour indicator people know ,"['able', 'taxi', 'book', 'different', 'colour', 'indicator', 'people', 'know']",Should be able to see your own taxi you booked in different colour or some different indicator because some people don't know the roads that well
692,fu come rain ,"['fu', 'come', 'rain']",What the fu...k any not come to if rain
693,useful app great service suggestion upcoming trip option edit need cancel book small time ,"['useful', 'app', 'great', 'service', 'suggestion', 'upcoming', 'trip', 'option', 'edit', 'need', 'cancel', 'book', 'small', 'time']",Very useful app along with great service. One suggestion:  In upcoming trip make an option to edit trip. Otherwise need to cancel and book again for small time changes.
694,trust like pick ,"['trust', 'like', 'pick']",I trust and i like thatdy i am trevelg pick me
695,service time like ,"['service', 'time', 'like']",Its a 100%gurentee service on time.i like it
696,booking facility present ,"['booking', 'facility', 'present']",The pre booking facility is not present
697,convenient late ,"['convenient', 'late']",Its convenient and the latest technolgy be updated
698,order driver tell exact location say knew come minute roam wrong wait fuel tank fault clearly know properly trouble ,"['order', 'driver', 'tell', 'exact', 'location', 'say', 'knew', 'come', 'minute', 'roam', 'wrong', 'wait', 'fuel', 'tank', 'fault', 'clearly', 'know', 'properly', 'trouble']","Once I ordered a Tuk and called the driver to tell him the exact location .Then he said he knew it and would come in a minute.But I could see him roaming in the wrong lanes and places. I had to wait 20 mins and at last he called me and said his fuel tank is empty because of all this, as if it was MY fault.After I've said the location clearly,he was still roaming here and there.Please tell your drivers to know the lanes and roads properly and not to put the customers in trouble."
699,need taxi ,"['need', 'taxi']",Just need  more taxi
700,allow book ,"['allow', 'book']",Allow pre-booking for less than 2 hours.
701,good need difficult simultaneously log multiple enter provide use device parent ,"['good', 'need', 'difficult', 'simultaneously', 'log', 'multiple', 'enter', 'provide', 'use', 'device', 'parent']","Good,need some improvements. Its quite difficult to simultaneously log in using multiple devices. You need to enter your details again and again provided you use one device as a parent device."
702,cheat price well service ,"['cheat', 'price', 'well', 'service']",Cheating price for tuks and no better service as before
703,bad tell fine ,"['bad', 'tell', 'fine']",nothing bad to tell.fine
704,sri number taxi service ,"['sri', 'number', 'taxi', 'service']",Sri lankan number 1 taxi service
705,enable option multiple drop instance need pick convenient approximate cost calculate trip ,"['enable', 'option', 'multiple', 'drop', 'instance', 'need', 'pick', 'convenient', 'approximate', 'cost', 'calculate', 'trip']",Please enable the option to have multiple drop off locations. For instance if we need to go to Nugegoda and then pick some one and then go to Dehivala it would be convenient if an approximate cost could be calculated for the whole trip. :)
706,good service like ,"['good', 'service', 'like']",Very good service I like it
707,good select car want ,"['good', 'select', 'car', 'want']",It is good because u can select any car u want
708,use service unreasonable new suck ,"['use', 'service', 'unreasonable', 'new', 'suck']","I will not use this service anymore due to the unreasonable new pricing....! You suck, pickme..!"
709,pick convenient ,"['pick', 'convenient']",Pick me is convenient
710,use delete purpose old version better ,"['use', 'delete', 'purpose', 'old', 'version', 'better']",crashing...can't use it...so im gonna delete it....what's the purpose of using it....the old version was better...
711,refuse come late ,"['refuse', 'come', 'late']",But some drivers refuse to come...and so late...
712,want specially need upgrade app ,"['want', 'specially', 'need', 'upgrade', 'app']",Drivers  to what ever  they want  specially tuk tuk ......... need to upgrade  the  drivers not the app .....
713,crap update hopeless ,"['crap', 'update', 'hopeless']",Crap after the update.. Hopeless..
714,service poor dump ,"['service', 'poor', 'dump']","Service poor, drivers dump nothing to say"
715,love pick easy use comparable ,"['love', 'pick', 'easy', 'use', 'comparable']",I very love pick me because it is very easy to use and comparable
716,taxi app say forever arrive total time waste ,"['taxi', 'app', 'say', 'forever', 'arrive', 'total', 'time', 'waste']",After requesting a taxi..app is keep saying requesting forever and taxi never arrive :p... Total time wasting
717,easy affordable comfortable hate people attitude ,"['easy', 'affordable', 'comfortable', 'hate', 'people', 'attitude']",Easy... affordable.... Comfortable.. hate some people's attitude though...
718,people sri travel experience better recommend specially ,"['people', 'sri', 'travel', 'experience', 'better', 'recommend', 'specially']",U people just made sri lankan travel experience much better. Recommend to all specially to travellers. Keep it up
719,forever detect location ,"['forever', 'detect', 'location']",Now it takes forever to detect my location
720,simple use realistic ,"['simple', 'use', 'realistic']",Simple to use and realistic
721,recent app wrong location forever complete booking work fine late look matter ,"['recent', 'app', 'wrong', 'location', 'forever', 'complete', 'booking', 'work', 'fine', 'late', 'look', 'matter']",Recent updates made the app slower and it shows a wrong location. It takes forever to complete a booking. It was working fine before the latest updates.look into this matter
722,not wait add unfair ,"['not', 'wait', 'add', 'unfair']",They didnt wait for me but still waiting charges has added very unfair
