,Reviews,KeyWords,text
398,love app font discount wheel driver time way better pick cost low communicate relation navigation ,"['love', 'app', 'font', 'discount', 'wheel', 'driver', 'time', 'way', 'better', 'pick', 'cost', 'low', 'communicate', 'relation', 'navigation']","i used to love this app, but then this had several issues. sometimes i font get my discount. and the three wheel driver calls me several times. but uber is way better than pick me and my cost is also very low. and i rately communicate with the driver with relation to navigation"
399,time wrong location ,"['time', 'wrong', 'location']",some time wrong location
400,update app slow load easy ride road new ,"['update', 'app', 'slow', 'load', 'easy', 'ride', 'road', 'new']",After the update app is very slow not even loading... Its easy to take ride by the road.. Then using this new pickme app
401,rating star lot route far find location price nice ,"['rating', 'star', 'lot', 'route', 'far', 'find', 'location', 'price', 'nice']",not rating 5 star cuz a lot of drivers cancelled the route cuz they're too far or they can't find the location. But the price is really nice.
402,time ride disappoint middle finger ,"['time', 'ride', 'disappoint', 'middle', 'finger']",i called 3 times for a ride but they all rejected it.. disappointed 🖕
403,location wrong route go expressway update ,"['location', 'wrong', 'route', 'go', 'expressway', 'update']",location details are wrong. the route always goes through the expressway even if it's a tuk. please update
404,good tax hire app sri need like driver profile manual selection available option view individual single rating ,"['good', 'tax', 'hire', 'app', 'sri', 'need', 'like', 'driver', 'profile', 'manual', 'selection', 'available', 'option', 'view', 'individual', 'single', 'rating']","PickMec has been a good tax hire app in Sri Lanka. Need few updates. Need some features like viewing driver profile before accepting, manual selection of available driver, Option to view driver individual ratings rather than single rating."
405,loyal user pick time thing add customer service need well like speak app peak contact ,"['loyal', 'user', 'pick', 'time', 'thing', 'add', 'customer', 'service', 'need', 'well', 'like', 'speak', 'peak', 'app', 'contact']",been a loyal user of pick me for a looong time. haven't had too many issues wrt to drivers & fares. Only thing I'd add is that your customer service needs to be better. I'd like it if there was someone who I can speak to when i have issues with the app during peak time etc. to contact.
406,location time wrong ,"['location', 'time', 'wrong']",Location every time wrong
407,unsatisfied come available time arrive location worth give star ,"['unsatisfied', 'come', 'available', 'time', 'arrive', 'location', 'worth', 'give', 'star']",so unsatisfied... drivers aren't coming although they are available. and drivers take too much time to arrive to the location. not even worth of giving a one star
408,absolutely great taxi service sri app user friendly food delivery remarkable add convenient ,"['absolutely', 'great', 'taxi', 'service', 'sri', 'app', 'user', 'friendly', 'food', 'delivery', 'remarkable', 'add', 'convenient']","Absolutely a great taxi service for Sri Lanka. App is very well done and user friendly. Also, the PickMe food delivery service is a remarkable add-on and so convenient."
409,driver demand extra money come closer ,"['driver', 'demand', 'extra', 'money', 'come', 'closer']",no vehicles when needed and driver demanding extra money to come if he is not closer
410,book taxis try trip ,"['book', 'taxis', 'try', 'trip']",why can't I book taxis..? and whenever I try to book one it says that trip started... what's this?
411,unreliable service wait long time cancel route unprofessional ,"['unreliable', 'service', 'wait', 'long', 'time', 'cancel', 'route', 'unprofessional']","Unreliable service, have to wait for a long time and drivers cancel the trips when they get hires on their route.. unprofessional and unreliable...."
412,totally useless app hear go not like destination cancel ride try star possible ,"['totally', 'useless', 'app', 'hear', 'go', 'not', 'like', 'destination', 'cancel', 'ride', 'try', 'star', 'possible']","Still totally useless app! Drivers call and when they hear where you are going, and they dont like destination they just cancel ride!!! Dont even try this app! Useless, uninstalling! Would give 0 star if possible!"
413,easy convenient reliable ,"['easy', 'convenient', 'reliable']",easy convenient and reliable
414,pick need deal issue driver behaviour app experience case conduct stong research unit understand system focus consumer interaction good step digital technology interface tech hope improve ,"['deal', 'issue', 'behaviour', 'experience', 'case', 'conduct', 'stong', 'research', 'unit', 'understand', 'system', 'focus', 'consumer', 'interaction', 'step', 'digital', 'technology', 'tech', 'interface', 'hope']",PICK ME NEEDS TO DEAL ISSUE WITH DRIVER BEHAVIOUR AND TO TEAIN DRIVERS THROUGH APP TO BECOME EXPERIENCE NAVIGATORS (IN ALL CATEGORIES). IN THIS CASE IT NEEDS TO CONDUCT A STONG RESEARCH UNIT TO UNDERSTAND WEAKNESES IN THE SYSTEM AND TO FOCUS ON DRIVER AND CONSUMER INTERACTION. HOWERVER BRINGS A GOOD STEP UP FOR SRI LANKA DIGITAL TECHNOLOGY. INTERFACE AND TECH IS 40/100. HOPE TO SEE PICK ME IMPROVE.
415,late update actually bad need able skip driver show app like not want look choose route destination victory hand ,"['late', 'update', 'actually', 'bad', 'need', 'able', 'skip', 'driver', 'show', 'app', 'like', 'not', 'want', 'look', 'choose', 'route', 'destination', 'victory', 'hand']","the latest update is actually worse, we need to be able to skip the driver shown in the app like bwfore , we dont want it to look like uber app at all. and we should be able to choose our own route to the destination. ✌️"
416,wait time high approximate price difference evening traffic get meter road ,"['wait', 'time', 'high', 'approximate', 'price', 'difference', 'evening', 'traffic', 'get', 'meter', 'road']","waiting time is very high, there approximate price has much difference. on few evening there no any traffic so not waiting time but got much higher price than the meter tuk tuk that you can get from the road. not recommended"
417,app holiday sri good service understand take long come pick edit experience want location confirmation customer provide standardized tell option ,"['app', 'holiday', 'sri', 'good', 'service', 'understand', 'take', 'long', 'come', 'pick', 'edit', 'experience', 'want', 'location', 'confirmation', 'customer', 'provide', 'standardized', 'tell', 'option']",i used the app while on holiday in sri lanka. although it provides a good service i do not understand why it always took so long for the drivers to come pick me up (edit: ive foundbout drivers experience gps issues sometimes and want location confirmation from customer). i always had to call them. why does the app not provide standardized messages to tell the drivers to come pick customer up on the gps/asked location? please make this an option.
418,order pick city today unfortunately driver wrong party phone switch way communicate use app cancel trip long taxi hire vehicle road people staff able help get bunch ,"['order', 'city', 'today', 'unfortunately', 'wrong', 'party', 'phone', 'switch', 'way', 'communicate', 'long', 'hire', 'vehicle', 'road', 'people', 'staff', 'able', 'help', 'get', 'bunch']",We ordered a pick up from Colombo city centre today unfortunately the driver picked up a wrong party. As the drivers phone was switched off there was no way of communicating. We couldn't make use of the app or cancel our trip as long as the taxi is hired. We could see the vehicle on the other side of the road picking up the wrong people. The pick me staff at Colombo city centre was not able to help us in getting another taxi. They were just a bunch of jokers.
419,today service st time prob transportation experience pick send near driver come long distance ride blah say sorry not know cancellation use better consider thank ,"['today', 'st', 'prob', 'transportation', 'experience', 'send', 'near', 'come', 'long', 'distance', 'ride', 'blah', 'say', 'sorry', 'not', 'know', 'cancellation', 'better', 'consider', 'thank']","today i used this service 1st time,due to unaviidable prob arised with my pvt transportation. but the experience was unpleaseant. as i hv heard, pick me send the nearest driver..bt today, the driver has come along a long distance than i had to go. then the ride was full of driver's critisism. blah blah. i said sorry, as i didnt know abt the cancellation...i will not use this again..u better send the nearest driver, if not plz consider the distances..thank you."
420,good service need able rate order food map view nearby addition list helpful browse select restaurant take position not scroll way specific complaint ,"['able', 'rate', 'order', 'food', 'map', 'view', 'nearby', 'addition', 'list', 'helpful', 'browse', 'select', 'restaurant', 'take', 'position', 'not', 'scroll', 'way', 'specific', 'complaint']","Good service. However, PickMe Foods needs some more refinements; 1) Need to be able to rate the restaurants which we order food from 2) A map view of the nearby restaurants in addition to the list would be helpful 3) When browsing the list, when I select a restaurant and then go back, I am taken back to the begining of the list. I should be taken to the last position I was in the list so that I dont need to scroll all the way back 4) There should be PickMe Foods specific complaint options"
421,comfortable normal money want tell company ,"['comfortable', 'normal', 'money', 'want', 'tell', 'company']","I get a verry quik drivers and also very comfortable and verry safty drivers .When we go in normal threeweel and Pickme threeweel ,I gess pickme is less than from money than normal threeweel ,at last I want to tell you,I am so proud of your company"
422,app better find charge usual price ,"['app', 'better', 'find', 'charge', 'usual', 'price']",This app is better than other apps but I found some drivers who charge more than the usual price
423,app developer team know deference user interface experience food favorite useful hope add future good luck get fast delivery excellent love note pay cash problem card check order ,"['developer', 'team', 'deference', 'interface', 'experience', 'favorite', 'useful', 'hope', 'future', 'luck', 'fast', 'delivery', 'excellent', 'love', 'note', 'pay', 'cash', 'problem', 'card', 'check']","100% for the PickMe app Developer or the Team! Really know about the deference between user interface and user experience! Most developers don't know about that. PickMe Food is my favorite! Very useful! Hope you will add more places in the future! Good luck guys! Hats off to the app developers! I got the full experiences. Fast delivery! Excellent! Love it. (Note: if you are paying cash then no problem at all, but if you are paying from card check your order again otherwise canceling the order will be a problem and that's nomal)"
424,late update book trip ,"['late', 'update', 'book', 'trip']",After latest update i cannot book my next trip!
425,majority idea know use single driver evening time ask cancel booking ,"['majority', 'idea', 'know', 'use', 'single', 'driver', 'evening', 'time', 'ask', 'cancel', 'booking']",The majority of drivers have no idea about the roads nor don't know how to use Google maps. Also not a single driver picks when it's around evening time and they always call you and ask where to go and cancel the booking..
426,app great persistent problem delay completion feel like deliberate customer service instead refund length tell need instruct end leave vehicle case effect afraid shall future possible ,"['great', 'persistent', 'problem', 'delay', 'completion', 'feel', 'deliberate', 'instead', 'refund', 'length', 'tell', 'instruct', 'end', 'leave', 'case', 'effect', 'afraid', 'shall', 'future', 'possible']",:( This app would be great except... There is a persistent problem with overcharging by tuk tuk drivers delaying completion of rides. I feel like this has happened often enough to be deliberate overcharging. I reported this to pickme customer service but instead of a refund i was questioned at length about my rides and then told i need to instruct drivers to end fares when i leave their vehicle. If that's really the case there should be instructions to that effect in the app UI. I'm afraid I'll be using Uber in the future whenever possible.
427,get wheeler kilometer charge cheating ,"['get', 'wheeler', 'kilometer', 'charge', 'cheating']",Once I got into a Pickme three wheeler from Hulfstdorp. First kilometer charge was Rs.60.00 and there after Rs.45. 00 for every other kilometer. CHEATING!
428,pick location permission give ,"['pick', 'location', 'permission', 'give']",Doesn't pick my location. even when permission is given and location is on
429,get emergency pick better show reasonable price fine good luck ,"['get', 'emergency', 'pick', 'better', 'show', 'reasonable', 'price', 'fine', 'good', 'luck']","I got emergency, pick me is better than uber.. showing reasonable price.. it will be. fine if pick me have more cars.. good luck.."
430,bad service order app way map maybe network connection come move opposite direction think turn go driver time bother answer cancel trip responsible ,"['bad', 'order', 'way', 'map', 'maybe', 'network', 'connection', 'come', 'move', 'opposite', 'direction', 'think', 'turn', 'go', 'driver', 'bother', 'answer', 'cancel', 'trip', 'responsible']","The Worst Service.Yestrday I ordered a pickme tuk.App showed it was on the way.So we waited.But for 10 minutes on the map it didn't move at all.We it maybe the network connection.It must me coming.Then it started moving opposite direction.We thought it's gonna take a turn and come.But it went on.We waited for 30 mins.Accrding to the map he wasn't coming.We called the driver many times.And didn't even bother to answer or cancel the trip,so we can order someone else.Shudn't they b more responsible"
431,no taxi app time taxis day ,"['no', 'taxi', 'app', 'time', 'taxis', 'day']",No taxis! App not responding! At most needed times. No taxis on promo days at all.
432,disgusting service hope local kick ,"['disgusting', 'service', 'hope', 'local', 'kick']",Disgusting service. Hope another local service gets to kick your bottoms.
433,satisfactory good need ,"['satisfactory', 'good', 'need']",Satisfactory. Good. Caters our needs
434,need fast taxi provide method mobile datum ,"['need', 'fast', 'taxi', 'provide', 'method', 'mobile', 'datum']",I need fast taxis and need GPS providing method because in sometimes I would not having mobile data or WiFi
435,forgot phone pick rough time find add driver number receipt ,"['forgot', 'phone', 'pick', 'rough', 'time', 'find', 'add', 'driver', 'number', 'receipt']",I forgot my phone in a pick me mini and i had to go through rough time to find it back. Can you guys add driver's of phone number to the email receipt ??
436,ur journey ,"['ur', 'journey']",Cangrdulation to ur journey
437,type location come fetch ,"['type', 'location', 'come', 'fetch']",when i type the location it comes fetching location
438,cheat company low quality ,"['cheat', 'company', 'low', 'quality']",Cheating company with low quality drivers. I blacklisted this
439,worst app get promotion work begin trip charge come end high wen pay lie disappoint pick ,"['worst', 'app', 'get', 'promotion', 'work', 'begin', 'trip', 'charge', 'come', 'end', 'high', 'wen', 'pay', 'lie', 'disappoint', 'pick']",Worst app ever.. we got so many promotion codes but none of those works.. at the beginning trip charge shows as a less amount.but when we come to end it shows a higher amount.. so how can wen pay for that.. this app is a lie. Really disappointed about pick me..
440,enjoy taxi reach passenger concept country bring demand high coz feel unsafe ,"['enjoy', 'taxi', 'reach', 'passenger', 'concept', 'country', 'bring', 'demand', 'high', 'coz', 'feel', 'unsafe']",I enjoy the offers. Taxi reaching the passenger concept suits the country so well. Focussing more on drvers' disciplne (tuk drivers) would bring the demand to even higher levels coz no one likes feeling unsafe.
441,cheating use switch transportation travel assistance consider ride end ,"['cheating', 'use', 'switch', 'transportation', 'travel', 'assistance', 'consider', 'ride', 'end']",The drivers are cheating. Even when I use the promo codes they are not accepting it and they are asking for the full amount. I may have to switch from PickMe to any other transportation and travel assistance. If this is not considered and show the full amount after the ride is ended.
442,room improve ,"['room', 'improve']",Have room to improve
443,taxi service good little expensive food great app improve store list add option order address location people live like find helpful kudo ,"['taxi', 'good', 'little', 'expensive', 'food', 'great', 'improve', 'store', 'list', 'add', 'option', 'order', 'address', 'location', 'people', 'live', 'like', 'find', 'helpful', 'kudo']","Taxi service all good-little expensive than uber.the food service is great,but the app should improve.refreshes everytime when i go back from a food store to the store list-so has to go all over again.Please add the option to order to address-not location.People live in apartments like us will find it so helpful.kudos"
444,taxi service good like ask money app not professional old condition ,"['taxi', 'service', 'good', 'like', 'ask', 'money', 'app', 'not', 'professional', 'old', 'condition']",This taxi service is not good. Drivers like thieves. They ask more money than app shows. Not behaving professional. Undesent drivers and old vehicles. Not in good condition
445,navigation system fully wrong location tracker display far current nearby cab parking not indicate time service come fix soon good correctly people ,"['navigation', 'system', 'fully', 'wrong', 'location', 'tracker', 'display', 'far', 'current', 'nearby', 'cab', 'parking', 'not', 'indicate', 'come', 'fix', 'soon', 'good', 'correctly', 'people']",* Navigation system is fully wrong ... * location tracker is fully wrong ... * no display to the far my location and current nearby cab parking.. * Not indicate how many time take cab service come to my location Fix this mistakes too soon give the best service correctly for the people
446,like app ,"['like', 'app']",I like this app
447,bad system unprofessional go use pick ,"['bad', 'system', 'unprofessional', 'go', 'use', 'pick']",Worst complaining system. UNPROFESSIONAL DRIVERS. NEVER GOING TO USE PICK ME AGAIN.
448,driver pick parcel location follow cause taxi meter work high tech convenience tell route ,"['driver', 'pick', 'parcel', 'location', 'follow', 'cause', 'taxi', 'meter', 'work', 'high', 'tech', 'convenience', 'tell', 'route']",Wanted a driver to pick up a parcel from one location to another. Says that they can't follow locations cause if they put Google maps the taxi meter won't work. So much for high tech convenience had to tell the whole route.
449,hell wrong app get use available want incident comment time usually write good service sad ,"['hell', 'wrong', 'app', 'get', 'use', 'available', 'want', 'incident', 'comment', 'time', 'usually', 'write', 'good', 'service', 'sad']",What the hell is wrong with this app now...there are no vehicles at almost anytime..im getting promo codes and that codes and offers but whats the use if this is not available when we want...this is not a one incident comment this happened to me so many times..very often..please do something..i usually never write comments on apps but this was a good service now all crashed..so sad about that.
450,improve ,['improve'],Its quite okay.can improve.
451,long reach destination charge not change safe mode travel ,"['long', 'reach', 'destination', 'charge', 'not', 'change', 'safe', 'mode', 'travel']","The drivers take long roads to reach the destination and they charge more, claiming they dont change to give .and before it was a safe mode to travel but not anymore"
452,good night ,"['good', 'night']",good for night travels
453,fare availability little rare ,"['fare', 'availability', 'little', 'rare']","Fare rates and availability around nittambuwa, yakkala is little rare."
454,time clear ,"['time', 'clear']",Some time not clear
455,pick map show correct location update ,"['pick', 'map', 'show', 'correct', 'location', 'update']",Pick me map can't showing correct location. ...? Pls update#
456,good stop improve need driver selection show like ,"['good', 'stop', 'improve', 'need', 'driver', 'selection', 'show', 'like']",Good . Never stop improving. Need a driver selection . Always showing one driver who we don't like.
457,help sure available time hard ride trip ,"['help', 'sure', 'available', 'time', 'hard', 'ride', 'trip']",Plz help make sure your extimate is available every time plz it is hard to ride a trip with out
458,automatically say install app like ,"['automatically', 'say', 'install', 'app', 'like']","It is automatically poping up saying install this app, its like spam"
459,come location ,"['come', 'location']",It comes that to on the location in settings But the location was on
460,company provide proper navigation able consume service satisfactory level location time irritate thumb ,"['company', 'provide', 'proper', 'navigation', 'able', 'consume', 'service', 'satisfactory', 'level', 'location', 'time', 'irritate', 'thumb']",This company does not provide the proper navigation facilities therefore we as consumers are not able to consume the service up to a satisfactory level because drivers call us and keep asking the location time and time again which is so irritating 👎
461,perfectly service like ,"['perfectly', 'service', 'like']",Perfectly the service is done.....and the drivers are like friends.........
462,fare take wait charge driver road money best good service smile app junk like normal time well thumb ,"['fare', 'take', 'wait', 'charge', 'driver', 'road', 'money', 'best', 'good', 'service', 'smile', 'app', 'junk', 'like', 'normal', 'time', 'well', 'thumb']","It shows fare 296 and took 490, 200 was their waiting charge it seems,driver perposly wait in road to get waiting money . UBER IS BEST,BEST SERVICE WITH SMILE , IN THIS APP ,ALL JUNK DRIVER LIKE APP, ONLY MONEY normal road tuk thousands time BETTER. 👎👎👎👎"
463,hard area try request purpose difficult daily user service matter concern ,"['hard', 'area', 'try', 'request', 'purpose', 'difficult', 'daily', 'user', 'service', 'matter', 'concern']","From around 6.30 to around 9.30 am,its really hard to get a pickme tuk. Even if the drivers are online in our area,when we try to request for a tuk,on purpose they go offline. Its really difficult as i am a daily user of pickme and your service says 24 hours service. Please take this matter into concern. Pickme user"
464,hell not remember pick help waste time ,"['hell', 'not', 'remember', 'pick', 'help', 'waste', 'time']",Why the hell just signed us out ???? We cant remember our passwords....and thats it...no more pick me....thas BS... please help wth it.... i wasted alot time because of that !!!!
465,like app useful occasional instance today driver begin trip get say company train road discipline ,"['like', 'app', 'useful', 'occasional', 'instance', 'today', 'driver', 'begin', 'trip', 'get', 'say', 'company', 'train', 'road', 'discipline']","I like this app it's useful but there are occasional glitches. For instance today a driver had begun a trip even before I got in, when asked why he said that's how the company trained him. Also sometimes the driver's have no road discipline"
466,code option appear order vehicle ,"['code', 'option', 'appear', 'order', 'vehicle']",The promo code option doesn't appear after I order a vehicle.
467,app upgrade wait request driver finish trip previously cancel min mistake add option ,"['app', 'upgrade', 'wait', 'request', 'driver', 'finish', 'trip', 'previously', 'cancel', 'min', 'mistake', 'add', 'option']","What happened to the app, why don't you you guys upgrade the severs. Sometimes I have to wait 15+ minutes to make a request or driver to finish the trip. Previously one of the driver asked me to cancel the trip, but before I do that he started the trip, so I had to wait 45mins until he realized his mistake, so please please add a failsafe option for that"
468,app good customer service well start need agent assistance care ,"['app', 'good', 'customer', 'service', 'well', 'start', 'need', 'agent', 'assistance', 'care']","The app is good, but customer service could be better. To start with, they need to have agent assistance in their customer care hotline."
469,good like ,"['good', 'like']",It's not good like the uber
470,bad update disappoint ,"['bad', 'update', 'disappoint']",Worse after the update.disappointed :-((
471,cheep comfortable ,"['cheep', 'comfortable']",It cheep and comfortable
472,unbelievable work sri easy taxi service go ,"['unbelievable', 'work', 'sri', 'easy', 'taxi', 'service', 'go']",What a Unbelievable Work From Sri Lanka..How Easy The Taxi Service Going to Be In SL
473,pickup location lata dura contact nam good thank face blow kiss ,"['pickup', 'location', 'lata', 'dura', 'contact', 'nam', 'good', 'thank', 'face', 'blow', 'kiss']","Okkoma hodai, eth pickup location eka godak welawata drivers lata pennnanawa weradi, mmm thawa ekak theenawa, godak dura inna pickme driverslawa thama godak welawata apita contact karanne, E tika erenna mata nam meka best, Thank you,, 😘"
474,no sri ,"['no', 'sri']",No 1 in sri lanka
475,useless non local find central city use ,"['useless', 'use', 'non', 'local', 'find', 'central', 'city']","Useless for tourists with non local numbers. Found me rides in Colombo's central city areas only, elsewhere and in Mirissa and Kandy it was of no use."
